{
  "schema_version": "1.0.0",
  "registry_version": "pom-concepts-v1",
  "contracts": {
    "pom": {
      "path": "auto_mode_rules/pom-template.json",
      "version": "core18-2026-07-18b",
      "fingerprint": "sha256:c2e59a557885a7e3614074505a272af491b35f6ad3b18cf021a32362f1396483"
    },
    "anchor": {
      "path": "auto_mode_rules/anchor-schema.json",
      "version": "anchors-2026-07-26-cup-width-own-height",
      "fingerprint": "sha256:39bb59d252d39791c1c1c326366279370d8b534d1e1ada5ce75a1660df314096"
    }
  },
  "numbering_policy": {
    "immutable": true,
    "core_range": {
      "first": 1,
      "last": 18
    },
    "next_assignable_number": 19,
    "never_reuse_retired_numbers": true,
    "joins_use": "concept_id"
  },
  "concepts": [
    {
      "concept_id": "half_bottom_band_relax",
      "pom_number": 1,
      "canonical_name_en": "1/2 Bottom band - Relax",
      "canonical_name_zh": "下围半宽（放松量）",
      "status": "active_contract",
      "aliases_approved": [
        "Bottom band Width 1/2 - Relax - closet hook"
      ],
      "measurement_method": "Half-perimeter of the bottom band measured at rest.",
      "view": "front_outer",
      "placement_view_role": "front_outer",
      "required_anchors": [
        "band-left",
        "band-right"
      ],
      "optional_anchors": [],
      "pairing": {
        "role": "primary",
        "partner_concept_id": "half_bottom_band_extend"
      },
      "unit": "in",
      "grade_rule_family": "crossian-house-v1",
      "held": false,
      "expected_confidence_tier": "high",
      "applicability_policy": null,
      "number_assigned_at": "2026-07-10T00:00:00Z",
      "retired_at": null
    },
    {
      "concept_id": "half_bottom_band_extend",
      "pom_number": 2,
      "canonical_name_en": "1/2 Bottom band - Extend",
      "canonical_name_zh": "下围半宽（延伸量）",
      "status": "active_contract",
      "aliases_approved": [
        "Bottom band Width 1/2 - Extended - closet hook"
      ],
      "measurement_method": "Half-perimeter of the bottom band measured in its extended state.",
      "view": "front_outer",
      "placement_view_role": "front_outer",
      "required_anchors": [
        "band-left",
        "band-right"
      ],
      "optional_anchors": [],
      "pairing": {
        "role": "secondary",
        "partner_concept_id": "half_bottom_band_relax"
      },
      "unit": "in",
      "grade_rule_family": "crossian-house-v1",
      "held": false,
      "expected_confidence_tier": "high",
      "applicability_policy": null,
      "number_assigned_at": "2026-07-10T00:00:00Z",
      "retired_at": null
    },
    {
      "concept_id": "half_chest_measure_straight",
      "pom_number": 3,
      "canonical_name_en": "1/2 chest - Measure straight",
      "canonical_name_zh": "胸围半宽（放松量）",
      "status": "active_contract",
      "aliases_approved": [
        "Chest Width 1/2 - Relax - closet hook"
      ],
      "measurement_method": "Half-perimeter of the chest line measured straight across.",
      "view": "front_outer",
      "placement_view_role": "front_outer",
      "required_anchors": [
        "chest-left",
        "chest-right"
      ],
      "optional_anchors": [],
      "pairing": {
        "role": "primary",
        "partner_concept_id": "half_chest_extend"
      },
      "unit": "in",
      "grade_rule_family": "crossian-house-v1",
      "held": false,
      "expected_confidence_tier": "high",
      "applicability_policy": null,
      "number_assigned_at": "2026-07-10T00:00:00Z",
      "retired_at": null
    },
    {
      "concept_id": "half_chest_extend",
      "pom_number": 4,
      "canonical_name_en": "1/2 chest - Extend",
      "canonical_name_zh": "胸围半宽（延伸量）",
      "status": "active_contract",
      "aliases_approved": [
        "Chest Width 1/2 - Extended - closet hook"
      ],
      "measurement_method": "Half-perimeter of the chest line measured in its extended state.",
      "view": "front_outer",
      "placement_view_role": "front_outer",
      "required_anchors": [
        "chest-left",
        "chest-right"
      ],
      "optional_anchors": [],
      "pairing": {
        "role": "secondary",
        "partner_concept_id": "half_chest_measure_straight"
      },
      "unit": "in",
      "grade_rule_family": "crossian-house-v1",
      "held": false,
      "expected_confidence_tier": "high",
      "applicability_policy": null,
      "number_assigned_at": "2026-07-10T00:00:00Z",
      "retired_at": null
    },
    {
      "concept_id": "center_front_height",
      "pom_number": 5,
      "canonical_name_en": "Center front height",
      "canonical_name_zh": "前中高度",
      "status": "active_contract",
      "aliases_approved": [],
      "measurement_method": "Vertical distance from the top to the bottom of the center-front seam.",
      "view": "front_outer",
      "placement_view_role": "front_outer",
      "required_anchors": [
        "cf-top",
        "cf-bottom"
      ],
      "optional_anchors": [],
      "pairing": null,
      "unit": "in",
      "grade_rule_family": "crossian-house-v1",
      "held": false,
      "expected_confidence_tier": "medium",
      "applicability_policy": null,
      "number_assigned_at": "2026-07-10T00:00:00Z",
      "retired_at": null
    },
    {
      "concept_id": "cradle_height_center_front",
      "pom_number": 6,
      "canonical_name_en": "Cradle height at center front",
      "canonical_name_zh": "托架前中高度",
      "status": "active_contract",
      "aliases_approved": [],
      "measurement_method": "Vertical cradle distance at center front, from cradle top to band bottom.",
      "view": "front_outer",
      "placement_view_role": "front_outer",
      "required_anchors": [
        "cradle-cf-top",
        "cf-bottom"
      ],
      "optional_anchors": [],
      "pairing": null,
      "unit": "in",
      "grade_rule_family": "crossian-house-v1",
      "held": false,
      "expected_confidence_tier": "medium",
      "applicability_policy": null,
      "number_assigned_at": "2026-07-10T00:00:00Z",
      "retired_at": null
    },
    {
      "concept_id": "cradle_height_bottom_cup",
      "pom_number": 7,
      "canonical_name_en": "Cradle height at bottom cup",
      "canonical_name_zh": "托架底杯高度",
      "status": "active_contract",
      "aliases_approved": [],
      "measurement_method": "Vertical cradle height at the base of the cup.",
      "view": "front_outer",
      "placement_view_role": "front_outer",
      "required_anchors": [
        "cradle-cup-top",
        "cradle-cup-bottom"
      ],
      "optional_anchors": [],
      "pairing": null,
      "unit": "in",
      "grade_rule_family": "crossian-house-v1",
      "held": false,
      "expected_confidence_tier": "medium",
      "applicability_policy": null,
      "number_assigned_at": "2026-07-10T00:00:00Z",
      "retired_at": null
    },
    {
      "concept_id": "cup_height_center_front",
      "pom_number": 8,
      "canonical_name_en": "Cup height at center front",
      "canonical_name_zh": "前中杯高",
      "status": "active_contract",
      "aliases_approved": [],
      "measurement_method": "Vertical cup-only distance at center front, from cup top to cradle top.",
      "view": "front_outer",
      "placement_view_role": "front_outer",
      "required_anchors": [
        "cf-top",
        "cradle-cf-top"
      ],
      "optional_anchors": [],
      "pairing": null,
      "unit": "in",
      "grade_rule_family": "crossian-house-v1",
      "held": false,
      "expected_confidence_tier": "medium",
      "applicability_policy": null,
      "number_assigned_at": "2026-07-10T00:00:00Z",
      "retired_at": null
    },
    {
      "concept_id": "cup_height",
      "pom_number": 9,
      "canonical_name_en": "Cup height",
      "canonical_name_zh": "杯高",
      "status": "active_contract",
      "aliases_approved": [
        "Cup height on foam",
        "Cup height outer",
        "Outer Cup height",
        "Foam Cup height",
        "Inner Cup Height",
        "Cup height inner"
      ],
      "measurement_method": "Vertical cup height from the cup apex to the cup-bottom seam.",
      "view": "front_outer",
      "placement_view_role": "front_outer",
      "required_anchors": [
        "inner-cup-top",
        "inner-cup-bottom"
      ],
      "optional_anchors": [],
      "pairing": null,
      "unit": "in",
      "grade_rule_family": "crossian-house-v1",
      "held": false,
      "expected_confidence_tier": "medium",
      "applicability_policy": null,
      "number_assigned_at": "2026-07-10T00:00:00Z",
      "retired_at": null
    },
    {
      "concept_id": "cup_width",
      "pom_number": 10,
      "canonical_name_en": "Cup width",
      "canonical_name_zh": "杯宽",
      "status": "active_contract",
      "aliases_approved": [
        "Cup width on foam",
        "Foam Cup Width",
        "Outer Cup width",
        "Inner Cup Width",
        "Cup width outer"
      ],
      "measurement_method": "Horizontal cup width at mid-height.",
      "view": "front_outer",
      "placement_view_role": "front_outer",
      "required_anchors": [
        "inner-cup-left",
        "inner-cup-right"
      ],
      "optional_anchors": [],
      "pairing": null,
      "unit": "in",
      "grade_rule_family": "crossian-house-v1",
      "held": false,
      "expected_confidence_tier": "medium",
      "applicability_policy": null,
      "number_assigned_at": "2026-07-10T00:00:00Z",
      "retired_at": null
    },
    {
      "concept_id": "side_seam_length",
      "pom_number": 11,
      "canonical_name_en": "Side seam length",
      "canonical_name_zh": "侧缝长度",
      "status": "active_contract",
      "aliases_approved": [
        "Sideseam length"
      ],
      "measurement_method": "Length of the side seam from underarm to band.",
      "view": "back",
      "placement_view_role": "back",
      "required_anchors": [
        "side-top",
        "side-bottom"
      ],
      "optional_anchors": [],
      "pairing": null,